{
  "job_id": "11111111-1111-4111-8111-111111111111",
  "tenant_id": "tenant-example",
  "owner_subject": "00u-example-user",
  "base_visibility": {
    "mode": "okta_group",
    "okta_group_id": "00g-example-research-team"
  },
  "version": 2,
  "reader_subjects": [
    {
      "grant_id": "77777777-7777-4777-8777-777777777777",
      "subject": "00u-example-reader",
      "actions": ["list_job", "read_status", "read_events", "read_report", "read_evidence"],
      "expires_at": "2026-10-30T12:30:00Z",
      "granted_at": "2026-10-23T12:30:00Z",
      "granted_by_subject": "00u-example-user"
    }
  ],
  "created_at": "2026-10-23T12:00:00Z",
  "updated_at": "2026-10-23T12:30:00Z"
}
