{
  "job_id": "11111111-1111-4111-8111-111111111111",
  "tenant_id": "tenant-example",
  "owner_subject": "00u-example-user",
  "base_visibility": {
    "mode": "okta_group",
    "okta_group_id": "00g-example-research-team"
  },
  "version": 1,
  "reader_subjects": [],
  "created_at": "2026-10-23T12:00:00Z",
  "updated_at": "2026-10-23T12:00:00Z"
}
